<?xml version="1.0"?>
<cfg:config xmlns:xsi="http://www.w3.org/2001/XMLSchema-instance"
            xsi:schemaLocation="https://aslweb.cr.usgs.gov SeedScanConfig.xsd"
            xmlns:cfg="config.seedscan.asl">

    <!--cfg:lockfile>/qcwork/seedscan/seedscan.lock</cfg:lockfile-->
    <cfg:lockfile>seedscan.lock</cfg:lockfile>
 
    <cfg:log>
        <cfg:levels>
            <!-- OFF, SEVERE, WARNING, INFO, CONFIG, FINE, FINER, FINEST, ALL -->
            <cfg:level cfg:name="">FINEST</cfg:level>
            <cfg:level cfg:name="asl.seedscan">FINEST</cfg:level>
            <cfg:level cfg:name="asl.seedscan.Scanner">INFO</cfg:level>
            <cfg:level cfg:name="asl.seedsplitter">INFO</cfg:level>
        </cfg:levels>

        <cfg:handlers>
            <cfg:log_console>
                <cfg:handler_level>FINEST</cfg:handler_level>
            </cfg:log_console>

            <cfg:log_file>
                <cfg:handler_level>FINE</cfg:handler_level>
                <cfg:directory>logs</cfg:directory>
                <cfg:prefix>seedscan-</cfg:prefix>
                <cfg:suffix>.log</cfg:suffix>
            </cfg:log_file>

            <cfg:log_db>
                <cfg:handler_level>CONFIG</cfg:handler_level>
                <cfg:database>
                    <!--cfg:uri>jdbc:mysql://catbox2.cr.usgs.gov/stations</cfg:uri-->
                    <cfg:uri>jdbc:mysql://136.177.121.210:54321/seedscan</cfg:uri>
                    <cfg:username>seedscan_write</cfg:username>
                    <cfg:password>
                        <cfg:plain>S33dSc@nWr1t3r!</cfg:plain>
                        <!--cfg:encrypted>
                            <cfg:salt>952bf002cc030243</cfg:salt>
                            <cfg:iv>952bf002cc030243952bf002cc030243</cfg:iv>
                            <cfg:ciphertext>2f9cb9a02ee92a392f9cb9a02ee92a39</cfg:ciphertext>
                            <cfg:hmac>952bf002cc030243952bf002cc030243</cfg:hmac>
                        <cfg:encrypted-->
                    </cfg:password>
                </cfg:database>
            </cfg:log_db>
        </cfg:handlers>
    </cfg:log>
  
    <cfg:database>
        <!--cfg:uri>jdbc:mysql://catbox2.cr.usgs.gov/stations</cfg:uri-->
        <cfg:uri>jdbc:mysql://136.177.121.210:54321/seedscan</cfg:uri>
        <cfg:username>seedscan_write</cfg:username>
        <cfg:password>
            <cfg:plain>S33dSc@nWr1t3r!</cfg:plain>
            <!--cfg:encrypted>
                <cfg:salt>952bf002cc030243</cfg:salt>
                <cfg:iv>952bf002cc030243952bf002cc030243</cfg:iv>
                <cfg:ciphertext>2f9cb9a02ee92a392f9cb9a02ee92a39</cfg:ciphertext>
                <cfg:hmac>952bf002cc030243952bf002cc030243</cfg:hmac>
            <cfg:encrypted-->
        </cfg:password>
    </cfg:database>

    <cfg:scans>
        <cfg:scan cfg:id="1">
            <cfg:path>/xs0/seed/${NETWORK}_${STATION}/${YEAR}/${YEAR}_${JDAY}_${NETWORK}_${STATION}</cfg:path>
            <cfg:frequency>
                <cfg:days cfg:value="1">
                    <cfg:hour cfg:value="22"/>
                </cfg:days>
            </cfg:frequency>
            <cfg:start_depth>1</cfg:start_depth>
            <cfg:scan_depth>2</cfg:scan_depth>
            <cfg:operations>
                <cfg:operation>
                    <cfg:calibration/>
                </cfg:operation>
            </cfg:operations>
        </cfg:scan>
     
        <cfg:scan cfg:id="2">
            <cfg:path>/xs0/seed/${NETWORK}_${STATION}/${YEAR}/${YEAR}_${JDAY}_${NETWORK}_${STATION}</cfg:path>
            <cfg:frequency>
                <cfg:years cfg:value="1">
                    <cfg:month cfg:value="12">
                        <cfg:day cfg:value="24">
                            <cfg:hour cfg:value="22">
                                <cfg:minute cfg:value="30"/>
                            </cfg:hour>
                        </cfg:day>
                    </cfg:month>
                </cfg:years>
            </cfg:frequency>
            <cfg:start_depth>1</cfg:start_depth>
            <cfg:scan_depth>366</cfg:scan_depth>
            <cfg:operations>
                <cfg:operation>
                    <cfg:calibration/>
                </cfg:operation>
            </cfg:operations>
        </cfg:scan>
    </cfg:scans>
    
</cfg:config>
